<?xml version='1.0' encoding='ISO-8859-1'?>

<!DOCTYPE dictionary SYSTEM "WPS-dictionary.dtd" >

<dictionary name="Feeds" >
	<comment>Feeds Categories Dictionary</comment>

	<entities>
		<Feeds-entities name="Media Sociaux">
			<URL-connection>
				<url>{$feed}</url>
			</URL-connection>
		</Feeds-entities>
	</entities>
	
	<env-property name="$web_context" value ="http://localhost:8080/wps-server/" />
	
	<affinity-reader-profile name="AffReader" affinity-reader-ref="*" threshold="100" />
	<affinity-reader-profile name="DiscoveryAffReader" affinity-reader-ref="*" threshold="100" />
	<affinity-reader-profile name="GlobalAffReader" affinity-reader-ref="*" threshold="100" />

	<analysis-profile name="Profile" attributes-ref="JDBC_Profile" type="personal" attribute-size="frequency">
		<props-mapping>
			<entity-props-mapping>
				<mapping key="ID" 	value="id" />
				<mapping key="NAME" value="name" />
			</entity-props-mapping>
			<attribute-props-mapping>
				<mapping key="ID" 	value="id" />
				<mapping key="NAME" value="name" />
				<mapping key="POSS_ID" 	value="poss_id" />
				<mapping key="POSS_NAME" value="poss_name" />
			</attribute-props-mapping>
		</props-mapping>
		<entities-recommendation>
			<mapping key="REC_ID"  		value="id" />
			<mapping key="REC_NAME"  	value="name" />
		</entities-recommendation>
	</analysis-profile>

	<analysis-profile name="DiscoveryProfile" attributes-ref="JDBC_Profile" type="discovery" attribute-size="frequency" attributes-max="300" >
		<props-mapping>
			<entity-props-mapping>
				<mapping key="ID" 	value="id" />
				<mapping key="NAME" value="name" />
			</entity-props-mapping>
			<attribute-props-mapping>
				<mapping key="ID" 	value="id" />
				<mapping key="NAME" value="name" />
				<mapping key="POSS_ID" 	value="poss_id" />
				<mapping key="POSS_NAME" value="poss_name" />
			</attribute-props-mapping>
		</props-mapping>
		<entities-recommendation>
			<mapping key="REC_ID"  		value="id" />
			<mapping key="REC_NAME"  	value="name" />
		</entities-recommendation>
	</analysis-profile>

	<analysis-profile name="GlobalProfile" attributes-ref="JDBC_Profile" type="global" attribute-size="same" attributes-max="60" >
		<props-mapping>
			<entity-props-mapping>
				<mapping key="ID" 	value="id" />
				<mapping key="NAME" value="name" />
			</entity-props-mapping>
			<attribute-props-mapping>
				<mapping key="ID" 	value="id" />
				<mapping key="NAME" value="name" />
				<mapping key="POSS_ID" 	value="poss_id" />
				<mapping key="POSS_NAME" value="poss_name" />
			</attribute-props-mapping>
		</props-mapping>
		<entities-recommendation>
			<mapping key="REC_ID"  		value="id" />
			<mapping key="REC_NAME"  	value="name" />
		</entities-recommendation>
	</analysis-profile>

	<display-profile name="Display" display-empty-links="no" in-color="FFFFFF" out-color="0" filter-color="FFFFFF" >
		<swatch-segmentation>
			<attribute-swatch>
				<norm-swatch default-ref="FEED_NODE_NORM" />
				<ref-swatch default-ref="FEED_NODE_REF" />
				<active-norm-swatch default-ref="FEED_NODE_CUR_NORM" />
				<active-ref-swatch default-ref="FEED_NODE_CUR_REF" />
			</attribute-swatch>
			<link-swatch>
				<norm-swatch default-ref="FEED_LINK_NORM" />
				<ref-swatch default-ref="FEED_LINK_REF" />
				<active-norm-swatch default-ref="FEED_LINK_CUR_NORM" />
				<active-ref-swatch default-ref="FEED_LINK_CUR_REF" />
			</link-swatch>
		</swatch-segmentation>
		<selection-swatch name="search" />
	</display-profile>

	<display-profile name="GlobalDisplay" display-empty-links="no" display-fake-links="no" in-color="FFFFFF" out-color="0" filter-color="FFFFFF" >
		<swatch-segmentation>
			<attribute-swatch>
				<norm-swatch default-ref="FEED_NODE_NORM" />
				<ref-swatch default-ref="FEED_NODE_REF" />
				<active-norm-swatch default-ref="FEED_NODE_CUR_NORM" />
				<active-ref-swatch default-ref="FEED_NODE_CUR_REF" />
			</attribute-swatch>
			<link-swatch>
				<norm-swatch default-ref="FEED_LINK_NORM" />
				<ref-swatch default-ref="FEED_LINK_REF" />
				<active-norm-swatch default-ref="FEED_LINK_CUR_NORM" />
				<active-ref-swatch default-ref="FEED_LINK_CUR_REF" />
			</link-swatch>
		</swatch-segmentation>
		<selection-swatch name="search" />
	</display-profile>

	<segmentation>
		<analysis-segmentation  default-ref="Profile" />
		<affinity-reader-segmentation default-ref="AffReader" >
			<affreader-analysis-mapping analysis-ref="DiscoveryProfile" default-ref="DiscoveryAffReader" />
			<affreader-analysis-mapping analysis-ref="GlobalProfile" default-ref="GlobalAffReader" />
		</affinity-reader-segmentation>
		<display-segmentation default-ref="Display" >
			<display-analysis-mapping analysis-ref="GlobalProfile" default-ref="GlobalDisplay" />
		</display-segmentation>
	</segmentation>
	
</dictionary>
